item,required,status,evidence
evidence abstraction protocol exists,true,pending,backend/exotics_drug_dose_source_evidence_abstraction.py
matrix covers all expanded exotic species groups,true,pending,EXOTICS_DRUG_DOSE_SOURCE_EVIDENCE_ABSTRACTION_MATRIX_V1.csv
allowed fields limited to metadata and qualitative safety themes,true,pending,doc + validator
numeric medication amount blocked,true,pending,matrix numeric_dose_value_allowed=false
route and frequency text blocked,true,pending,matrix route_text_allowed=false and frequency_text_allowed=false
prescription and treatment protocol blocked,true,pending,matrix prescription_direction_allowed=false
no database writes,true,pending,safety.writes_database=false
human review required,true,pending,requires_human_review=true
